URL,Title,H1,Mot-clé principal,Nombre de mots,Liens internes sortants,Liens internes entrants,Code source (chemin),Volume recherche (estimé),Ancres suggérées pour maillage,Code source complet
"https://indhack.com/","Consultante SEO & Experte Référencement Naturel","Dominez Google.Devenez le N°1.","consultante seo & experte",597,98,20,"app/page.tsx",390,"","import { Metadata } from ""next"";\nimport Link from ""next/link"";\nimport dynamic from ""next/dynamic"";\nimport { Hero } from ""@/components/Hero"";\nimport { TrustSignalsStatic } from ""@/components/sections/TrustSignalsStatic"";\nimport { HomepageSchemas } from ""@/components/seo/JsonLdSchemas"";\nimport { Search, ArrowRight, MapPin, BookOpen } from ""lucide-react"";\n\n// Dynamic imports for below-the-fold components (reduces initial JS bundle)\nconst ServicesSection = dynamic(() => import(""@/components/ServicesSection"").then(mod => ({ default: mod.ServicesSection })), {\n    loading: () => <div className=""py-20 bg-white"" />,\n});\nconst SEOScoreChecker = dynamic(() => import(""@/components/SEOScoreChecker"").then(mod => ({ default: mod.SEOScoreChecker })), {\n    loading: () => <div className=""py-16 bg-ink"" />,\n});\nconst CityCarousel = dynamic(() => import(""@/components/sections/CityCarousel"").then(mod => ({ default: mod.CityCarousel })), {\n    loading: () => <div className=""py-20 bg-gray-50"" />,\n});\nconst AboutSection = dynamic(() => import(""@/components/AboutSection"").then(mod => ({ default: mod.AboutSection })), {\n    loading: () => <div className=""py-16 bg-white"" />,\n});\nconst CTASection = dynamic(() => import(""@/components/CTASection"").then(mod => ({ default: mod.CTASection })), {\n    loading: () => <div className=""py-16 bg-ink"" />,\n});\nconst FAQ = dynamic(() => import(""@/components/FAQ"").then(mod => ({ default: mod.FAQ })), {\n    loading: () => <div className=""py-14 bg-white"" />,\n});\n\nexport const metadata: Metadata = {\n    title: ""Consultante SEO & Experte Référencement Naturel"",\n    description: ""Consultante SEO freelance spécialisée en référencement naturel, SEO local et création de site web. Audit SEO gratuit. Nice & toute la France. ✆ 06 61 13 97 48"",\n    alternates: {\n        canonical: ""https://indhack.com""\n    },\n    openGraph: {\n        title: ""Consultante SEO & Experte Référencement Naturel"",\n        description: ""Dominez Google avec une stratégie SEO sur-mesure. Audit gratuit, accompagnement personnalisé."",\n        url: ""https://indhack.com"",\n        type: ""website"",\n    }\n};\n\n// Homepage FAQ optimisée - SANS gras dans les questions\nconst HOMEPAGE_FAQ = [\n    {\n        question: ""À quoi sert un audit SEO pour mon site web ?"",\n        answer: ""Un audit SEO est une analyse complète de votre site pour identifier ce qui bloque votre visibilité sur Google. On détecte les erreurs techniques, les opportunités de mots-clés et on vous livre une feuille de route priorisée par impact business.""\n    },\n    {\n        question: ""Combien de temps faut-il pour voir des résultats ?"",\n        answer: ""Les premiers résultats apparaissent entre 3 et 6 mois pour le référencement classique. Pour le SEO local ou des optimisations techniques rapides, cela peut être visible en 2-4 semaines. C'est un investissement long terme qui prend de la valeur chaque mois.""\n    },\n    {\n        question: ""Quelle différence entre référencement naturel et référencement payant ?"",\n        answer: ""Le référencement naturel (SEO) vous positionne gratuitement dans les résultats Google. Le référencement payant (publicité) vous fait payer pour chaque clic. Le SEO est un investissement durable qui continue à générer du trafic même quand vous arrêtez de payer.""\n    },\n    {\n        question: ""Proposez-vous uniquement du référencement ou aussi la création de site ?"",\n        answer: ""Expertise complète : audit SEO, référencement naturel, création de sites web haute performance, refonte avec sécurisation du trafic, gestion de réseaux sociaux et design orienté conversion. Une approche globale pour dominer votre marché.""\n    },\n    {\n        question: ""Travaillez-vous avec des petites entreprises ?"",\n        answer: ""Principalement avec des PME, startups et entrepreneurs ambitieux qui veulent accélérer leur croissance organique. Approche personnalisée, agile et orientée résultats. Du sur-mesure stratégique, pas de formule industrielle.""\n    },\n    {\n        question: ""Combien coûte une prestation de référencement ?"",\n        answer: ""Chaque projet est unique et les tarifs sont adaptés à vos objectifs spécifiques. Un audit gratuit de 15 minutes permet d'évaluer vos besoins et de vous proposer un devis sur-mesure, sans engagement. L'investissement dépend de la complexité du projet et des résultats visés.""\n    }\n];\n\nexport default function Home() {\n    return (\n        <>\n            {/* Schemas JSON-LD : Organization + LocalBusiness + WebSite */}\n            <HomepageSchemas />\n\n            <div className=""flex flex-col"">\n                <Hero />\n                <TrustSignalsStatic />\n                <ServicesSection />\n                <SEOScoreChecker />\n                <CityCarousel\n                    title=""J'interviens partout en France""\n                    subtitle=""Consultante SEO à votre service""\n                />\n\n                {/* Section Maillage - Outils, Articles, Villes */}\n                <section className=""py-20 bg-white"">\n                    <div className=""container mx-auto px-4"">\n                        <div className=""max-w-6xl mx-auto"">\n                            <div className=""text-center mb-12"">\n                                <h2 className=""text-3xl font-heading font-bold text-ink mb-4"">\n                                    Ressources <span className=""text-sauge"">gratuites</span> pour votre SEO\n                                </h2>\n                                <p className=""text-soft max-w-2xl mx-auto"">\n                                    Outils en ligne, guides pratiques et expertise locale pour booster votre visibilité.\n                                </p>\n                            </div>\n\n                            <div className=""grid md:grid-cols-3 gap-8"">\n                                {/* Outils gratuits */}\n                                <div className=""bg-gray-50 p-8 rounded-2xl border border-gray-100"">\n                                    <div className=""w-12 h-12 bg-sauge/10 rounded-xl flex items-center justify-center mb-4"">\n                                        <Search className=""w-6 h-6 text-sauge"" />\n                                    </div>\n                                    <h3 className=""text-xl font-bold text-ink mb-4"">Outils SEO gratuits</h3>\n                                    <ul className=""space-y-3"">\n                                        <li>\n                                            <Link href=""/outils/audit-seo-gratuit"" className=""text-sauge hover:underline inline-flex items-center gap-1"">\n                                                Audit SEO en 30 secondes\n                                                <ArrowRight className=""w-3 h-3"" />\n                                            </Link>\n                                        </li>\n                                        <li>\n                                            <Link href=""/outils/testeur-visibilite-ia"" className=""text-sauge hover:underline inline-flex items-center gap-1"">\n                                                Testeur visibilité IA (ChatGPT, Perplexity)\n                                                <ArrowRight className=""w-3 h-3"" />\n                                            </Link>\n                                        </li>\n                                        <li>\n                                            <Link href=""/outils/generateur-schema-json-ld"" className=""text-sauge hover:underline inline-flex items-center gap-1"">\n                                                Générateur données structurées\n                                                <ArrowRight className=""w-3 h-3"" />\n                                            </Link>\n                                        </li>\n                                        <li>\n                                            <Link href=""/outils/generateur-robots-txt"" className=""text-sauge hover:underline inline-flex items-center gap-1"">\n                                                Générateur robots.txt IA\n                                                <ArrowRight className=""w-3 h-3"" />\n                                            </Link>\n                                        </li>\n                                    </ul>\n                                </div>\n\n                                {/* Articles */}\n                                <div className=""bg-gray-50 p-8 rounded-2xl border border-gray-100"">\n                                    <div className=""w-12 h-12 bg-sauge/10 rounded-xl flex items-center justify-center mb-4"">\n                                        <BookOpen className=""w-6 h-6 text-sauge"" />\n                                    </div>\n                                    <h3 className=""text-xl font-bold text-ink mb-4"">Articles SEO</h3>\n                                    <ul className=""space-y-3"">\n                                        <li>\n                                            <Link href=""/blog/pourquoi-consultant-seo"" className=""text-sauge hover:underline inline-flex items-center gap-1"">\n                                                Pourquoi engager un consultant SEO\n                                                <ArrowRight className=""w-3 h-3"" />\n                                            </Link>\n                                        </li>\n                                        <li>\n                                            <Link href=""/blog/importance-audit-seo"" className=""text-sauge hover:underline inline-flex items-center gap-1"">\n                                                L'importance de l'audit SEO\n                                                <ArrowRight className=""w-3 h-3"" />\n                                            </Link>\n                                        </li>\n                                        <li>\n                                            <Link href=""/blog/seo-local-nice"" className=""text-sauge hover:underline inline-flex items-center gap-1"">\n                                                Guide du SEO local à Nice\n                                                <ArrowRight className=""w-3 h-3"" />\n                                            </Link>\n                                        </li>\n                                        <li>\n                                            <Link href=""/blog"" className=""text-ink font-medium hover:text-sauge inline-flex items-center gap-1"">\n                                                Voir tous les articles\n                                                <ArrowRight className=""w-3 h-3"" />\n                                            </Link>\n                                        </li>\n                                    </ul>\n                                </div>\n\n                                {/* Villes */}\n                                <div className=""bg-gray-50 p-8 rounded-2xl border border-gray-100"">\n                                    <div className=""w-12 h-12 bg-sauge/10 rounded-xl flex items-center justify-center mb-4"">\n                                        <MapPin className=""w-6 h-6 text-sauge"" />\n                                    </div>\n                                    <h3 className=""text-xl font-bold text-ink mb-4"">Expertise locale</h3>\n                                    <ul className=""space-y-3"">\n                                        <li>\n                                            <Link href=""/consultant-seo-nice"" className=""text-sauge hover:underline inline-flex items-center gap-1"">\n                                                Consultante SEO à Nice\n                                                <ArrowRight className=""w-3 h-3"" />\n                                            </Link>\n                                        </li>\n                                        <li>\n                                            <Link href=""/consultant-seo-cannes"" className=""text-sauge hover:underline inline-flex items-center gap-1"">\n                                                Consultante SEO à Cannes\n                                                <ArrowRight className=""w-3 h-3"" />\n                                            </Link>\n                                        </li>\n                                        <li>\n                                            <Link href=""/consultant-seo-sophia-antipolis"" className=""text-sauge hover:underline inline-flex items-center gap-1"">\n                                                Consultante SEO Sophia-Antipolis\n                                                <ArrowRight className=""w-3 h-3"" />\n                                            </Link>\n                                        </li>\n                                        <li>\n                                            <Link href=""/consultant-seo-antibes"" className=""text-sauge hover:underline inline-flex items-center gap-1"">\n                                                Consultante SEO à Antibes\n                                                <ArrowRight className=""w-3 h-3"" />\n                                            </Link>\n                                        </li>\n                                    </ul>\n                                </div>\n                            </div>\n                        </div>\n                    </div>\n                </section>\n\n                <AboutSection />\n                <CTASection />\n                <FAQ items={HOMEPAGE_FAQ} title=""Questions Fréquentes"" />\n            </div>\n        </>\n    );\n}\n"
"https://indhack.com/a-propos","À Propos","À Propos","à propos",0,0,3,"app/a-propos/page.tsx",0,"","import { Metadata } from ""next"";\nimport { AboutContent } from ""@/components/AboutContent"";\nimport { Breadcrumb, getServiceBreadcrumb } from ""@/components/Breadcrumb"";\n\nexport const metadata: Metadata = {\n    title: ""À Propos"",\n    description: ""Découvrez mon parcours : consultante SEO indépendante spécialisée en référencement naturel, audit technique et stratégie digitale. Accompagnement personnalisé pour PME et startups."",\n    alternates: {\n        canonical: ""https://indhack.com/a-propos""\n    },\n    openGraph: {\n        title: ""Indiana Aflalo - Consultante SEO & Experte Digitale"",\n        description: ""Spécialiste du référencement naturel, j'aide les entreprises à dominer Google et transformer leur visibilité en clients."",\n        url: ""https://indhack.com/a-propos"",\n    }\n};\n\n// Person Schema pour E-E-A-T\nconst personSchema = {\n    ""@context"": ""https://schema.org"",\n    ""@type"": ""Person"",\n    ""@id"": ""https://indhack.com/a-propos#person"",\n    ""name"": ""Indiana Aflalo"",\n    ""jobTitle"": ""Consultante SEO"",\n    ""description"": ""Consultante SEO indépendante spécialisée en référencement naturel, audit technique et stratégie digitale. 7+ ans d'expérience, 50+ clients accompagnés."",\n    ""url"": ""https://indhack.com/a-propos"",\n    ""image"": ""https://indhack.com/images/indiana-aflalo.jpg"",\n    ""email"": ""contact@indhack.com"",\n    ""telephone"": ""+33661139748"",\n    ""sameAs"": [\n        ""https://www.linkedin.com/in/indianaaflalo""\n    ],\n    ""worksFor"": {\n        ""@type"": ""Organization"",\n        ""name"": ""IndHack"",\n        ""url"": ""https://indhack.com""\n    },\n    ""knowsAbout"": [\n        ""Référencement naturel (SEO)"",\n        ""Audit SEO technique"",\n        ""SEO local"",\n        ""Google Business Profile"",\n        ""Core Web Vitals"",\n        ""Stratégie de contenu"",\n        ""Création de site web"",\n        ""Next.js"",\n        ""WordPress""\n    ],\n    ""alumniOf"": {\n        ""@type"": ""EducationalOrganization"",\n        ""name"": ""Master Stratégie Digitale & UX Design""\n    },\n    ""hasCredential"": [\n        {\n            ""@type"": ""EducationalOccupationalCredential"",\n            ""name"": ""Google Analytics 4 Certification""\n        }\n    ]\n};\n\nexport default function AboutPage() {\n    return (\n        <>\n            <script\n                type=""application/ld+json""\n                dangerouslySetInnerHTML={{ __html: JSON.stringify(personSchema) }}\n            />\n            <Breadcrumb items={getServiceBreadcrumb(""À propos"", ""/a-propos"")} />\n            <AboutContent />\n        </>\n    );\n}\n"
"https://indhack.com/admin-login","","","",0,0,0,"app/admin-login/page.tsx",2400,"","'use client';\n\nimport { useState } from 'react';\nimport { useRouter } from 'next/navigation';\nimport { motion } from 'framer-motion';\nimport { Lock, ArrowRight, Eye, EyeOff } from 'lucide-react';\n\nexport default function AdminLoginPage() {\n    const [password, setPassword] = useState('');\n    const [showPassword, setShowPassword] = useState(false);\n    const [error, setError] = useState('');\n    const [loading, setLoading] = useState(false);\n    const router = useRouter();\n\n    const handleSubmit = async (e: React.FormEvent) => {\n        e.preventDefault();\n        setLoading(true);\n        setError('');\n\n        try {\n            // Authentification via API sécurisée (pas de password en URL)\n            const response = await fetch('/api/admin-auth', {\n                method: 'POST',\n                headers: { 'Content-Type': 'application/json' },\n                body: JSON.stringify({ password }),\n            });\n\n            const result = await response.json();\n\n            if (result.success) {\n                // Cookie set par l'API, on peut redirect\n                router.push('/keystatic');\n            } else {\n                setError(result.error || 'Mot de passe incorrect');\n                setLoading(false);\n            }\n        } catch {\n            setError('Erreur de connexion. Réessayez.');\n            setLoading(false);\n        }\n    };\n\n    return (\n        <div className=""min-h-screen bg-ink flex items-center justify-center p-4"">\n            {/* Background effects */}\n            <div className=""absolute inset-0 pointer-events-none overflow-hidden"">\n                <div className=""absolute top-1/4 right-1/4 w-[500px] h-[500px] bg-[#638576]/10 rounded-full blur-[150px]"" />\n                <div className=""absolute bottom-1/4 left-1/4 w-[400px] h-[400px] bg-white/5 rounded-full blur-[120px]"" />\n            </div>\n\n            <motion.div\n                initial={{ opacity: 0, y: 20 }}\n                animate={{ opacity: 1, y: 0 }}\n                className=""relative z-10 w-full max-w-md""\n            >\n                <div className=""bg-white/5 backdrop-blur-xl border border-white/10 rounded-3xl p-8 shadow-2xl"">\n                    {/* Logo / Header */}\n                    <div className=""text-center mb-8"">\n                        <div className=""w-16 h-16 mx-auto mb-4 rounded-2xl bg-[#638576]/20 flex items-center justify-center"">\n                            <Lock className=""w-8 h-8 text-[#638576]"" />\n                        </div>\n                        <h1 className=""text-2xl font-bold text-white mb-2"">\n                            IndHack Admin\n                        </h1>\n                        <p className=""text-white/60 text-sm"">\n                            Accès réservé\n                        </p>\n                    </div>\n\n                    {/* Login Form */}\n                    <form onSubmit={handleSubmit} className=""space-y-6"">\n                        <div>\n                            <label className=""block text-white/80 text-sm font-medium mb-2"">\n                                Mot de passe\n                            </label>\n                            <div className=""relative"">\n                                <input\n                                    type={showPassword ? 'text' : 'password'}\n                                    value={password}\n                                    onChange={(e) => setPassword(e.target.value)}\n                                    className=""w-full px-4 py-4 bg-white/10 border border-white/20 rounded-xl text-white placeholder-white/40 focus:outline-none focus:border-[#638576] focus:ring-2 focus:ring-[#638576]/20 transition-all""\n                                    placeholder=""Entrez votre mot de passe""\n                                    required\n                                />\n                                <button\n                                    type=""button""\n                                    onClick={() => setShowPassword(!showPassword)}\n                                    className=""absolute right-4 top-1/2 -translate-y-1/2 text-white/40 hover:text-white transition-colors""\n                                >\n                                    {showPassword ? <EyeOff className=""w-5 h-5"" /> : <Eye className=""w-5 h-5"" />}\n                                </button>\n                            </div>\n                        </div>\n\n                        {error && (\n                            <motion.p\n                                initial={{ opacity: 0 }}\n                                animate={{ opacity: 1 }}\n                                className=""text-red-400 text-sm text-center""\n                            >\n                                {error}\n                            </motion.p>\n                        )}\n\n                        <button\n                            type=""submit""\n                            disabled={loading}\n                            className=""w-full py-4 bg-[#638576] hover:bg-[#4a6359] text-white font-bold rounded-xl transition-all duration-300 flex items-center justify-center gap-2 disabled:opacity-50""\n                        >\n                            {loading ? (\n                                <div className=""w-5 h-5 border-2 border-white/30 border-t-white rounded-full animate-spin"" />\n                            ) : (\n                                <>\n                                    Connexion\n                                    <ArrowRight className=""w-5 h-5"" />\n                                </>\n                            )}\n                        </button>\n                    </form>\n\n                    {/* Footer */}\n                    <p className=""text-center text-white/40 text-xs mt-6"">\n                        © {new Date().getFullYear()} IndHack - Espace sécurisé\n                    </p>\n                </div>\n            </motion.div>\n        </div>\n    );\n}\n"
"https://indhack.com/audit-seo","Audit SEO Complet | Diagnostic & Plan d","Audit SEO Complet | Diagnostic & Plan d","audit seo",0,0,59,"app/audit-seo/page.tsx",1600,"referencement naturel → /referencement-naturel | consultant seo → /consultant-seo | outil d'audit SEO gratuit → /outils/audit-seo-gratuit | demander un devis → /contact","import { Metadata } from ""next"";\nimport AuditSeoClient from ""./AuditSeoClient"";\nimport { Breadcrumb, getServiceBreadcrumb } from ""@/components/Breadcrumb"";\nimport { ServiceSchema } from ""@/components/seo/JsonLdSchemas"";\n\nexport const metadata: Metadata = {\n    title: ""Audit SEO Complet | Diagnostic & Plan d'Action – INDHACK"",\n    description: ""Identifiez les freins SEO de votre site en 48h. Rapport détaillé + roadmap priorisée par ROI. +150 points analysés. Audit gratuit disponible. ✆ 06 61 13 97 48"",\n    alternates: {\n        canonical: ""https://indhack.com/audit-seo""\n    },\n    openGraph: {\n        title: ""Audit SEO Complet"",\n        description: ""Diagnostic technique et sémantique de votre site. Identifiez vos freins SEO et obtenez un plan d'action priorisé."",\n        url: ""https://indhack.com/audit-seo"",\n        type: ""website"",\n        locale: ""fr_FR"",\n        siteName: ""IndHack"",\n        images: [{\n            url: ""https://indhack.com/api/og?title=Audit%20SEO%20Complet&subtitle=Diagnostic%20technique%20et%20s%C3%A9mantique%20de%20votre%20site"",\n            width: 1200,\n            height: 630,\n            alt: ""Audit SEO Complet""\n        }],\n    },\n    twitter: {\n        card: ""summary_large_image"",\n        title: ""Audit SEO Complet"",\n        description: ""Identifiez les freins SEO de votre site en 48h. +150 points analysés."",\n        images: [""https://indhack.com/api/og?title=Audit%20SEO%20Complet&subtitle=%2B150%20points%20analys%C3%A9s""],\n    },\n};\n\nexport default function AuditSeoPage() {\n    return (\n        <>\n            <ServiceSchema\n                name=""Audit SEO Complet""\n                description=""Identifiez les freins SEO de votre site en 48h. Rapport détaillé + roadmap priorisée par ROI. +150 points analysés.""\n                url=""https://indhack.com/audit-seo""\n                serviceType=""Audit SEO""\n            />\n            <Breadcrumb items={getServiceBreadcrumb(""Audit SEO Complet"", ""/audit-seo"")} />\n            <AuditSeoClient />\n        </>\n    );\n}\n"
