"https://indhack.com/consultant-seo-rennes","Consultant SEO Rennes","Consultant SEO Rennes","consultant seo rennes",1500,20,2,"app/consultant-seo-rennes/page.tsx",50,"SEO local en France → /seo-local | consultante SEO freelance → /consultant-seo | audit SEO technique → /audit-seo | référencement naturel → /referencement-naturel | création de site web → /creation-site-web | consultant SEO Nantes → /consultant-seo-nantes | audit SEO gratuit → /outils/audit-seo-gratuit","import { CityPageTemplateV2 } from ""@/components/templates/CityPageTemplateV2"";\nimport { getCityBySlug } from ""@/lib/cities-data"";\nimport { Metadata } from ""next"";\nimport { Breadcrumb, getCityBreadcrumb } from ""@/components/Breadcrumb"";\n\nconst cityData = getCityBySlug(""consultant-seo-rennes"")!;\n\nexport const metadata: Metadata = {\n    title: `Consultant SEO Rennes`,\n    description: `Boostez votre visibilité sur Google à ${cityData.name}. Consultante SEO freelance experte en référencement local pour PME et startups tech d'${cityData.department}. Audit gratuit ✆ 06 61 13 97 48`,\n    alternates: {\n        canonical: `https://indhack.com/${cityData.slug}`\n    },\n    openGraph: {\n        title: `Consultant SEO ${cityData.name} | Indiana Aflalo`,\n        description: `Dominez les résultats Google à ${cityData.name}. Référencement local, audit SEO et stratégie digitale pour entreprises bretonnes.`,\n        url: `https://indhack.com/${cityData.slug}`,\n    }\n};\n\nexport default function SeoRennesPage() {\n    return (\n        <>\n            <Breadcrumb items={getCityBreadcrumb(cityData.name, cityData.slug)} />\n            <CityPageTemplateV2 cityData={cityData} />\n        </>\n    );\n}\n"
"https://indhack.com/consultant-seo-rennes/audit-technique","Audit Technique SEO Rennes 35","Audit Technique SEO Rennes 35","audit seo rennes",0,0,1,"app/consultant-seo-rennes/audit-technique/page.tsx",1600,"","import { Metadata } from ""next"";\nimport { Breadcrumb, getCityServiceBreadcrumb } from ""@/components/Breadcrumb"";\nimport { CityServiceTemplate } from ""@/components/templates/CityServiceTemplate"";\nimport { getCityBySlug, getServiceContent } from ""@/lib/cities-data"";\n\nconst cityData = getCityBySlug(""consultant-seo-rennes"")!;\nconst serviceData = getServiceContent(""audit-technique"", ""consultant-seo-rennes"")!;\n\nexport const metadata: Metadata = {\n    title: ""Audit Technique SEO Rennes 35"",\n    description: ""Consultante SEO Rennes. Mon audit technique identifie les freins à votre référencement : indexation, vitesse, maillage. Diagnostic gratuit."",\n    openGraph: {\n        title: ""Audit Technique SEO Rennes 35"",\n        description: ""Freelance SEO Rennes. Analyse technique complète de votre site."",\n        url: ""https://indhack.com/consultant-seo-rennes/audit-technique"",\n        type: ""website"",\n        locale: ""fr_FR"",\n        siteName: ""IndHack""\n    },\n    alternates: {\n        canonical: ""https://indhack.com/consultant-seo-rennes/audit-technique""\n    }\n};\n\nexport default function AuditTechniqueRennesPage() {\n    return (\n        <>\n            <Breadcrumb items={getCityServiceBreadcrumb(cityData.name, cityData.slug, serviceData.title, ""audit-technique"")} />\n            <CityServiceTemplate cityData={cityData} serviceData={serviceData} />\n        </>\n    );\n}\n"
"https://indhack.com/consultant-seo-sophia-antipolis","Consultant SEO Sophia Antipolis | Expert SEO Technopole B2B","Consultant SEO Sophia Antipolis | Expert SEO Technopole B2B","consultant seo sophia antipolis",1500,20,8,"app/consultant-seo-sophia-antipolis/page.tsx",20,"SEO local en France → /seo-local | consultante SEO freelance → /consultant-seo | audit SEO technique → /audit-seo | référencement naturel → /referencement-naturel | création de site web → /creation-site-web | consultant SEO Nice → /consultant-seo-nice | consultant SEO Cannes → /consultant-seo-cannes | consultant SEO Antibes → /consultant-seo-antibes | audit SEO gratuit → /outils/audit-seo-gratuit","import { CityPageTemplateV2 } from ""@/components/templates/CityPageTemplateV2"";\nimport { getCityBySlug } from ""@/lib/cities-data"";\nimport { Metadata } from ""next"";\nimport { Breadcrumb, getCityBreadcrumb } from ""@/components/Breadcrumb"";\nimport { SophiaAntipolisContent } from ""./SophiaContent"";\n\nconst cityData = getCityBySlug(""consultant-seo-sophia-antipolis"")!;\n\nexport const metadata: Metadata = {\n    title: `Consultant SEO Sophia Antipolis | Expert SEO Technopole B2B`,\n    description: `Consultante SEO spécialisée startups et ESN à Sophia Antipolis. Référencement B2B tech, content marketing SaaS, génération de leads qualifiés. Audit gratuit. ✆ 06 61 13 97 48`,\n    alternates: {\n        canonical: `https://indhack.com/${cityData.slug}`\n    },\n    openGraph: {\n        title: `Consultant SEO Sophia Antipolis | Expert Technopole B2B`,\n        description: `Dominez Google sur le marché tech de Sophia Antipolis. SEO B2B, content marketing SaaS, stratégie de visibilité pour startups, ESN et scale-ups de la technopole.`,\n        url: `https://indhack.com/${cityData.slug}`,\n    }\n};\n\nexport default function SeoSophiaPage() {\n    return (\n        <>\n            <Breadcrumb items={getCityBreadcrumb(cityData.name, cityData.slug)} />\n            <CityPageTemplateV2\n                cityData={cityData}\n                customContent={<SophiaAntipolisContent />}\n            />\n        </>\n    );\n}\n"
"https://indhack.com/consultant-seo-sophia-antipolis/audit-technique","Audit Technique SEO Sophia Antipolis 06","Audit Technique SEO Sophia Antipolis 06","audit seo sophia antipolis",0,0,3,"app/consultant-seo-sophia-antipolis/audit-technique/page.tsx",1600,"","import { Metadata } from ""next"";\nimport { Breadcrumb, getCityServiceBreadcrumb } from ""@/components/Breadcrumb"";\nimport { CityServiceTemplate } from ""@/components/templates/CityServiceTemplate"";\nimport { getCityBySlug, getServiceContent } from ""@/lib/cities-data"";\n\nconst cityData = getCityBySlug(""consultant-seo-sophia-antipolis"")!;\nconst serviceData = getServiceContent(""audit-technique"", ""consultant-seo-sophia-antipolis"")!;\n\nexport const metadata: Metadata = {\n    title: ""Audit Technique SEO Sophia Antipolis 06"",\n    description: ""Freelance SEO tech à Sophia Antipolis. Audit technique pointu pour startups et entreprises tech. Crawl, indexation, Core Web Vitals."",\n    openGraph: {\n        title: ""Audit Technique SEO Sophia Antipolis 06"",\n        description: ""Consultante SEO technopole. Audit technique spécialisé pour le secteur tech."",\n        url: ""https://indhack.com/consultant-seo-sophia-antipolis/audit-technique"",\n        type: ""website"",\n        locale: ""fr_FR"",\n        siteName: ""IndHack""\n    },\n    alternates: {\n        canonical: ""https://indhack.com/consultant-seo-sophia-antipolis/audit-technique""\n    }\n};\n\nexport default function AuditTechniqueSophiaAntipolisPage() {\n    return (\n        <>\n            <Breadcrumb items={getCityServiceBreadcrumb(cityData.name, cityData.slug, serviceData.title, ""audit-technique"")} />\n            <CityServiceTemplate cityData={cityData} serviceData={serviceData} />\n        </>\n    );\n}\n"
"https://indhack.com/consultant-seo-strasbourg","Consultant SEO Strasbourg","Consultant SEO Strasbourg","consultant seo strasbourg",1500,20,3,"app/consultant-seo-strasbourg/page.tsx",70,"SEO local en France → /seo-local | consultante SEO freelance → /consultant-seo | audit SEO technique → /audit-seo | référencement naturel → /referencement-naturel | création de site web → /creation-site-web | consultant SEO Lille → /consultant-seo-lille | audit SEO gratuit → /outils/audit-seo-gratuit","import { CityPageTemplateV2 } from ""@/components/templates/CityPageTemplateV2"";\nimport { getCityBySlug } from ""@/lib/cities-data"";\nimport { Metadata } from ""next"";\nimport { Breadcrumb, getCityBreadcrumb } from ""@/components/Breadcrumb"";\n\nconst cityData = getCityBySlug(""consultant-seo-strasbourg"")!;\n\nexport const metadata: Metadata = {\n    title: `Consultant SEO Strasbourg`,\n    description: `Boostez votre visibilité sur Google à ${cityData.name}. Consultante SEO freelance experte en référencement local pour PME et entreprises du ${cityData.department}. Audit gratuit ✆ 06 61 13 97 48`,\n    alternates: {\n        canonical: `https://indhack.com/${cityData.slug}`\n    },\n    openGraph: {\n        title: `Consultant SEO ${cityData.name} | Indiana Aflalo`,\n        description: `Dominez les résultats Google à ${cityData.name}. Référencement local, audit SEO et stratégie digitale pour entreprises strasbourgeoises.`,\n        url: `https://indhack.com/${cityData.slug}`,\n    }\n};\n\nexport default function SeoStrasbourgPage() {\n    return (\n        <>\n            <Breadcrumb items={getCityBreadcrumb(cityData.name, cityData.slug)} />\n            <CityPageTemplateV2 cityData={cityData} />\n        </>\n    );\n}\n"
"https://indhack.com/consultant-seo-strasbourg/audit-technique","Audit Technique SEO Strasbourg 67","Audit Technique SEO Strasbourg 67","audit seo strasbourg",0,0,1,"app/consultant-seo-strasbourg/audit-technique/page.tsx",1600,"","import { Metadata } from ""next"";\nimport { Breadcrumb, getCityServiceBreadcrumb } from ""@/components/Breadcrumb"";\nimport { CityServiceTemplate } from ""@/components/templates/CityServiceTemplate"";\nimport { getCityBySlug, getServiceContent } from ""@/lib/cities-data"";\n\nconst cityData = getCityBySlug(""consultant-seo-strasbourg"")!;\nconst serviceData = getServiceContent(""audit-technique"", ""consultant-seo-strasbourg"")!;\n\nexport const metadata: Metadata = {\n    title: ""Audit Technique SEO Strasbourg 67"",\n    description: ""Référencement naturel Strasbourg. Audit technique SEO rigoureux : Screaming Frog, Search Console, Core Web Vitals. Consultante indépendante."",\n    openGraph: {\n        title: ""Audit Technique SEO Strasbourg 67"",\n        description: ""Spécialiste SEO Strasbourg. Diagnostic technique pour votre référencement."",\n        url: ""https://indhack.com/consultant-seo-strasbourg/audit-technique"",\n        type: ""website"",\n        locale: ""fr_FR"",\n        siteName: ""IndHack""\n    },\n    alternates: {\n        canonical: ""https://indhack.com/consultant-seo-strasbourg/audit-technique""\n    }\n};\n\nexport default function AuditTechniqueStrasbourgPage() {\n    return (\n        <>\n            <Breadcrumb items={getCityServiceBreadcrumb(cityData.name, cityData.slug, serviceData.title, ""audit-technique"")} />\n            <CityServiceTemplate cityData={cityData} serviceData={serviceData} />\n        </>\n    );\n}\n"
"https://indhack.com/consultant-seo-toulouse","Consultant SEO Toulouse","Consultant SEO Toulouse","consultant seo toulouse",1500,20,2,"app/consultant-seo-toulouse/page.tsx",140,"SEO local en France → /seo-local | consultante SEO freelance → /consultant-seo | audit SEO technique → /audit-seo | référencement naturel → /referencement-naturel | création de site web → /creation-site-web | consultant SEO Bordeaux → /consultant-seo-bordeaux | consultant SEO Montpellier → /consultant-seo-montpellier | audit SEO gratuit → /outils/audit-seo-gratuit","import { CityPageTemplateV2 } from ""@/components/templates/CityPageTemplateV2"";\nimport { getCityBySlug } from ""@/lib/cities-data"";\nimport { Metadata } from ""next"";\nimport { Breadcrumb, getCityBreadcrumb } from ""@/components/Breadcrumb"";\n\nconst cityData = getCityBySlug(""consultant-seo-toulouse"")!;\n\nexport const metadata: Metadata = {\n    title: `Consultant SEO Toulouse`,\n    description: `Boostez votre visibilité sur Google à ${cityData.name}. Consultante SEO freelance experte en référencement local pour PME et startups de ${cityData.department}. Audit gratuit ✆ 06 61 13 97 48`,\n    alternates: {\n        canonical: `https://indhack.com/${cityData.slug}`\n    },\n    openGraph: {\n        title: `Consultant SEO ${cityData.name} | Indiana Aflalo`,\n        description: `Dominez les résultats Google à ${cityData.name}. Référencement local, audit SEO et stratégie digitale pour entreprises toulousaines.`,\n        url: `https://indhack.com/${cityData.slug}`,\n    }\n};\n\nexport default function SeoToulousePage() {\n    return (\n        <>\n            <Breadcrumb items={getCityBreadcrumb(cityData.name, cityData.slug)} />\n            <CityPageTemplateV2 cityData={cityData} />\n        </>\n    );\n}\n"
"https://indhack.com/consultant-seo-toulouse/audit-technique","Audit Technique SEO Toulouse 31","Audit Technique SEO Toulouse 31","audit seo toulouse",0,0,1,"app/consultant-seo-toulouse/audit-technique/page.tsx",1600,"","import { Metadata } from ""next"";\nimport { Breadcrumb, getCityServiceBreadcrumb } from ""@/components/Breadcrumb"";\nimport { CityServiceTemplate } from ""@/components/templates/CityServiceTemplate"";\nimport { getCityBySlug, getServiceContent } from ""@/lib/cities-data"";\n\nconst cityData = getCityBySlug(""consultant-seo-toulouse"")!;\nconst serviceData = getServiceContent(""audit-technique"", ""consultant-seo-toulouse"")!;\n\nexport const metadata: Metadata = {\n    title: ""Audit Technique SEO Toulouse 31"",\n    description: ""Expert référencement Toulouse. Audit technique SEO complet : crawl, indexation, Core Web Vitals. Consultante freelance indépendante."",\n    openGraph: {\n        title: ""Audit Technique SEO Toulouse 31"",\n        description: ""Consultante SEO Toulouse. Diagnostic technique pour optimiser votre visibilité Google."",\n        url: ""https://indhack.com/consultant-seo-toulouse/audit-technique"",\n        type: ""website"",\n        locale: ""fr_FR"",\n        siteName: ""IndHack""\n    },\n    alternates: {\n        canonical: ""https://indhack.com/consultant-seo-toulouse/audit-technique""\n    }\n};\n\nexport default function AuditTechniqueToulousePage() {\n    return (\n        <>\n            <Breadcrumb items={getCityServiceBreadcrumb(cityData.name, cityData.slug, serviceData.title, ""audit-technique"")} />\n            <CityServiceTemplate cityData={cityData} serviceData={serviceData} />\n        </>\n    );\n}\n"
"https://indhack.com/contact","Contact","Contact","contact",0,0,24,"app/contact/page.tsx",0,"","import { Metadata } from ""next"";\nimport { ContactForm } from ""@/components/ContactForm"";\nimport { Breadcrumb, getServiceBreadcrumb } from ""@/components/Breadcrumb"";\n\nexport const metadata: Metadata = {\n    title: ""Contact"",\n    description: ""Contactez Indiana Aflalo, consultante SEO experte. Devis gratuit sous 24h. Audit SEO offert pour votre projet de référencement naturel ou création de site."",\n    alternates: {\n        canonical: ""https://indhack.com/contact""\n    },\n    openGraph: {\n        title: ""Contact | Indiana Aflalo - Consultante SEO"",\n        description: ""Discutons de votre projet SEO. Réponse sous 24h garantie, audit offert."",\n        url: ""https://indhack.com/contact"",\n    }\n};\n\nexport default function ContactPage() {\n    return (\n        <>\n            <Breadcrumb items={getServiceBreadcrumb(""Contact"", ""/contact"")} />\n            <ContactForm />\n        </>\n    );\n}\n"
"https://indhack.com/creation-boutique-en-ligne","Création Boutique en Ligne | E-commerce SEO Optimisé – INDHACK","Création Boutique en Ligne | E-commerce SEO Optimisé – INDHACK","création boutique en ligne",0,0,1,"app/creation-boutique-en-ligne/page.tsx",1300,"creation site web → /creation-site-web | referencement naturel → /referencement-naturel | outil d'audit SEO gratuit → /outils/audit-seo-gratuit | demander un devis → /contact","import { Metadata } from ""next"";\nimport CreationBoutiqueClient from ""./CreationBoutiqueClient"";\nimport { Breadcrumb, getServiceBreadcrumb } from ""@/components/Breadcrumb"";\nimport { ServiceSchema } from ""@/components/seo/JsonLdSchemas"";\n\nexport const metadata: Metadata = {\n    title: ""Création Boutique en Ligne | E-commerce SEO Optimisé – INDHACK"",\n    description: ""Création de boutique en ligne optimisée SEO. WooCommerce, Shopify, PrestaShop. Sites e-commerce performants et visibles sur Google. Devis gratuit. ✆ 06 61 13 97 48"",\n    alternates: {\n        canonical: ""https://indhack.com/creation-boutique-en-ligne""\n    },\n    openGraph: {\n        title: ""Création Boutique E-commerce"",\n        description: ""Boutique en ligne optimisée SEO dès la conception. Performance, conversion et visibilité Google."",\n        url: ""https://indhack.com/creation-boutique-en-ligne"",\n    }\n};\n\nexport default function CreationBoutiquePage() {\n    return (\n        <>\n            <ServiceSchema\n                name=""Création de Boutique en Ligne""\n                description=""Création de boutiques e-commerce optimisées SEO. WooCommerce, Shopify, PrestaShop.""\n                url=""https://indhack.com/creation-boutique-en-ligne""\n                serviceType=""Création E-commerce""\n            />\n            <Breadcrumb items={getServiceBreadcrumb(""Création Boutique en Ligne"", ""/creation-boutique-en-ligne"")} />\n            <CreationBoutiqueClient />\n        </>\n    );\n}\n"
"https://indhack.com/creation-site-web","Création de Site Web Optimisé SEO | Sites Performants – INDHACK","Création de Site Web Optimisé SEO | Sites Performants – INDHACK","création de site web",0,0,51,"app/creation-site-web/page.tsx",6600,"refonte site web → /refonte-site-web | audit seo → /audit-seo | referencement naturel → /referencement-naturel | outil d'audit SEO gratuit → /outils/audit-seo-gratuit | demander un devis → /contact","import { Metadata } from ""next"";\nimport CreationSiteClient from ""./CreationSiteClient"";\nimport { Breadcrumb, getServiceBreadcrumb } from ""@/components/Breadcrumb"";\nimport { ServiceSchema } from ""@/components/seo/JsonLdSchemas"";\n\nexport const metadata: Metadata = {\n    title: ""Création de Site Web Optimisé SEO | Sites Performants – INDHACK"",\n    description: ""Sites WordPress et Next.js ultra-rapides, conçus pour la conversion et le référencement. Design sur-mesure, sécurité maximale. Devis gratuit. ✆ 06 61 13 97 48"",\n    alternates: {\n        canonical: ""https://indhack.com/creation-site-web""\n    },\n    openGraph: {\n        title: ""Création de Site Web SEO"",\n        description: ""Lancez un site performant qui attire des clients. Design premium, vitesse optimisée et architecture SEO-ready."",\n        url: ""https://indhack.com/creation-site-web"",\n    }\n};\n\nexport default function CreationSiteWebPage() {\n    return (\n        <>\n            <ServiceSchema\n                name=""Création de Site Web""\n                description=""Sites WordPress et Next.js ultra-rapides, conçus pour la conversion et le référencement. Design sur-mesure, sécurité maximale.""\n                url=""https://indhack.com/creation-site-web""\n                serviceType=""Création de Site Web""\n            />\n            <Breadcrumb items={getServiceBreadcrumb(""Création de Site Web"", ""/creation-site-web"")} />\n            <CreationSiteClient />\n        </>\n    );\n}\n"
"https://indhack.com/dashboard","Tableau de Bord","Tableau de Bord","tableau de bord",0,0,0,"app/dashboard/page.tsx",0,"","import Link from ""next/link"";\nimport { ArrowRight, FileText, Globe, Settings, MapPin, Layout } from ""lucide-react"";\n\nexport const metadata = {\n    title: ""Tableau de Bord"",\n    robots: ""noindex, nofollow"" // On cache cette page de Google\n};\n\nexport default function DashboardPage() {\n    // Liste manuelle de tes pages pour avoir une vue d'ensemble propre\n    const pages = [\n        { name: ""Accueil"", path: ""/"", type: ""main"" },\n        { name: ""À Propos"", path: ""/a-propos"", type: ""main"" },\n        { name: ""Contact"", path: ""/contact"", type: ""main"" },\n        { name: ""Services"", path: ""/services"", type: ""main"" },\n        { name: ""Blog"", path: ""/blog"", type: ""content"" },\n        { name: ""Mentions Légales"", path: ""/mentions-legales"", type: ""legal"" },\n        { name: ""CGV"", path: ""/cgv"", type: ""legal"" },\n    ];\n\n    const landingPages = [\n        { name: ""Consultant SEO Nice"", path: ""/consultant-seo-nice"" },\n        { name: ""Consultant SEO Cannes"", path: ""/consultant-seo-cannes"" },\n        { name: ""Consultant SEO Antibes"", path: ""/consultant-seo-antibes"" },\n        { name: ""Audit Gratuit"", path: ""/audit-seo-gratuit"" },\n        { name: ""Refonte Site Web"", path: ""/refonte-site-web"" },\n        { name: ""Création Site Web"", path: ""/creation-site-web"" },\n    ];\n\n    return (\n        <div className=""min-h-screen bg-gray-50 p-8"">\n            <div className=""max-w-5xl mx-auto"">\n                <header className=""mb-12"">\n                    <h1 className=""text-4xl font-bold text-ink mb-4"">Control Room 🚀</h1>\n                    <p className=""text-xl text-soft"">Une vue d'ensemble de toutes les pages de ton site.</p>\n                </header>\n\n                <div className=""grid md:grid-cols-2 gap-8"">\n                    {/* PAGES PRINCIPALES */}\n                    <div className=""bg-white p-6 rounded-2xl shadow-sm border border-gray-100"">\n                        <h2 className=""text-2xl font-bold mb-6 flex items-center gap-2 text-ink"">\n                            <Globe className=""w-6 h-6 text-sauge"" /> Pages Principales\n                        </h2>\n                        <ul className=""space-y-3"">\n                            {pages.map((page) => (\n                                <li key={page.path}>\n                                    <Link href={page.path} className=""flex items-center justify-between p-3 rounded-lg hover:bg-gray-50 group transition-colors"">\n                                        <span className=""font-medium text-ink"">{page.name}</span>\n                                        <div className=""flex items-center gap-3"">\n                                            <span className=""text-xs text-gray-400 font-mono"">{page.path}</span>\n                                            <ArrowRight className=""w-4 h-4 text-gray-300 group-hover:text-sauge"" />\n                                        </div>\n                                    </Link>\n                                </li>\n                            ))}\n                        </ul>\n                    </div>\n\n                    {/* LANDING PAGES SEO */}\n                    <div className=""bg-white p-6 rounded-2xl shadow-sm border border-gray-100"">\n                        <h2 className=""text-2xl font-bold mb-6 flex items-center gap-2 text-ink"">\n                            <MapPin className=""w-6 h-6 text-orange-500"" /> Pages Locales & Offres\n                        </h2>\n                        <ul className=""space-y-3"">\n                            {landingPages.map((page) => (\n                                <li key={page.path}>\n                                    <Link href={page.path} className=""flex items-center justify-between p-3 rounded-lg hover:bg-gray-50 group transition-colors"">\n                                        <span className=""font-medium text-ink"">{page.name}</span>\n                                        <div className=""flex items-center gap-3"">\n                                            <span className=""text-xs text-gray-400 font-mono"">{page.path}</span>\n                                            <ArrowRight className=""w-4 h-4 text-gray-300 group-hover:text-orange-500"" />\n                                        </div>\n                                    </Link>\n                                </li>\n                            ))}\n                        </ul>\n                        <div className=""mt-6 pt-6 border-t border-gray-100"">\n                            <button className=""w-full py-3 bg-ink text-white rounded-lg font-bold opacity-50 cursor-not-allowed text-sm"">\n                                + Ajouter une nouvelle page (Bientôt disponible)\n                            </button>\n                        </div>\n                    </div>\n                </div>\n\n                {/* VISUALISATION STRUCTURE */}\n                <div className=""mt-8 bg-white p-6 rounded-2xl shadow-sm border border-gray-100"">\n                    <h2 className=""text-2xl font-bold mb-6 flex items-center gap-2 text-ink"">\n                        <Layout className=""w-6 h-6 text-blue-500"" /> Structure du Site\n                    </h2>\n                    <div className=""p-4 bg-gray-50 rounded-lg font-mono text-sm text-gray-600"">\n                        indhack.com<br />\n                        ├── / (Home)<br />\n                        ├── /a-propos<br />\n                        ├── /blog (Liste des articles)<br />\n                        │   └── /blog/[slug] (Article individuel)<br />\n                        └── /contact\n                    </div>\n                </div>\n            </div>\n        </div>\n    );\n}\n"
